{
  "surface": "git",
  "root": "",
  "scope": {
    "comparison": "working_tree_vs_index",
    "paths": []
  },
  "mode": "summary_only",
  "bounds": {
    "max_files": 100,
    "max_lines": 10000,
    "max_bytes": 1048576
  },
  "normalization": {
    "line_ending": false,
    "whitespace": "none"
  },
  "rename_detection": false,
  "discovery_ref": "",
  "intent_ref": ""
}
